{
  "version": 1,
  "case_id": "n31_media_change",
  "deadline": "2026-07-22",
  "status_vocabulary": ["COMPLETED", "READY", "AWAITING_HUMAN", "AWAITING_EXTERNAL"],
  "tasks": [
    {"task_id": "TECHNICAL_PACKAGE_FREEZE", "title": "冻结18项成果和自动检查", "priority": "P0", "owner_role": "TECHNICAL_OWNER", "due_date": "2026-07-18", "status": "COMPLETED", "blocking_scope": "NONE", "human_gate_id": null, "next_action": "成果变化后重新生成冻结清单并运行正式预检", "evidence": "output/submission/release_manifest_v1.json"},
    {"task_id": "TRAINING_VIDEO_FULL_WATCH", "title": "完整观看80秒培训视频", "priority": "P0", "owner_role": "CONTENT_OWNER", "due_date": "2026-07-20", "status": "AWAITING_HUMAN", "blocking_scope": "FORMAL_SUBMISSION", "human_gate_id": "TRAINING_VIDEO_FULL_WATCH", "next_action": "参赛者完整观看并绑定当前成片私有审核记录", "evidence": "PRIVATE_TRAINING_VIDEO_REVIEW"},
    {"task_id": "TEAM_ROSTER_AND_ELIGIBILITY", "title": "确认2至5人团队名单和分工", "priority": "P0", "owner_role": "SUBMISSION_OWNER", "due_date": "2026-07-20", "status": "AWAITING_HUMAN", "blocking_scope": "FORMAL_SUBMISSION", "human_gate_id": "TEAM_ELIGIBILITY_CONFIRMED", "next_action": "填写私有名单并对照报名资料确认", "evidence": "PRIVATE_SUBMISSION_STATE"},
    {"task_id": "OFFICIAL_RULES_REVIEW", "title": "取得并核对官方规则细则", "priority": "P0", "owner_role": "SUBMISSION_OWNER", "due_date": "2026-07-20", "status": "AWAITING_EXTERNAL", "blocking_scope": "FORMAL_SUBMISSION", "human_gate_id": "OFFICIAL_RULES_VERIFIED", "next_action": "取得官方讲义后核对六项未知要求", "evidence": "OFFICIAL_RULE_MATERIAL"},
    {"task_id": "FINAL_STAGE_REHEARSAL", "title": "完成180秒真人计时彩排", "priority": "P0", "owner_role": "DEMO_OPERATOR", "due_date": "2026-07-21", "status": "AWAITING_HUMAN", "blocking_scope": "FORMAL_SUBMISSION", "human_gate_id": "FINAL_STAGE_REHEARSAL", "next_action": "按冻结脚本计时彩排并保存记录", "evidence": "PRIVATE_REHEARSAL_RECORD"},
    {"task_id": "FINAL_RECORDING_REVIEW", "title": "录制并复核最终有声字幕视频", "priority": "P0", "owner_role": "DEMO_OPERATOR", "due_date": "2026-07-21", "status": "AWAITING_HUMAN", "blocking_scope": "FORMAL_SUBMISSION", "human_gate_id": "FINAL_RECORDING_REVIEW", "next_action": "录制后运行机器QA并完整人工观看", "evidence": "PRIVATE_FINAL_RECORDING"},
    {"task_id": "FINAL_CLEAN_PREFLIGHT", "title": "在最终提交运行干净预检", "priority": "P0", "owner_role": "TECHNICAL_OWNER", "due_date": "2026-07-21", "status": "READY", "blocking_scope": "FORMAL_SUBMISSION", "human_gate_id": null, "next_action": "全部内容冻结后运行bash scripts/check_submission.sh", "evidence": "PRIVATE_PREFLIGHT_REPORT"},
    {"task_id": "SUBMISSION_UPLOAD", "title": "上传作品页、附件和最终视频", "priority": "P0", "owner_role": "SUBMISSION_OWNER", "due_date": "2026-07-22", "status": "AWAITING_HUMAN", "blocking_scope": "FORMAL_SUBMISSION", "human_gate_id": null, "next_action": "按官方字段上传冻结成果", "evidence": "OFFICIAL_SUBMISSION_PAGE"},
    {"task_id": "PUBLIC_LINK_QA", "title": "验证三个公开入口匿名可访问", "priority": "P0", "owner_role": "FINAL_REVIEWER", "due_date": "2026-07-22", "status": "AWAITING_HUMAN", "blocking_scope": "FORMAL_SUBMISSION", "human_gate_id": null, "next_action": "填写私有网址并运行公开链接检查器", "evidence": "PRIVATE_PUBLICATION_LINKS_QA"},
    {"task_id": "SUBMISSION_RECEIPT", "title": "保存提交成功截图并人工复查", "priority": "P0", "owner_role": "FINAL_REVIEWER", "due_date": "2026-07-22", "status": "AWAITING_HUMAN", "blocking_scope": "FORMAL_SUBMISSION", "human_gate_id": null, "next_action": "保存回执并再次打开作品页", "evidence": "PRIVATE_SUBMISSION_RECEIPT"}
  ],
  "risks": [
    {"risk_id": "OFFICIAL_RULES_UNAVAILABLE", "owner_role": "SUBMISSION_OWNER", "probability": "MEDIUM", "impact": "HIGH", "status": "OPEN", "blocking_scope": "FORMAL_SUBMISSION", "trigger": "7月20日仍未取得官方规则细则", "mitigation": "联系组织方并保留公开核验快照，不推测未知规则"},
    {"risk_id": "FINAL_RECORDING_NOT_READY", "owner_role": "DEMO_OPERATOR", "probability": "MEDIUM", "impact": "HIGH", "status": "OPEN", "blocking_scope": "FORMAL_SUBMISSION", "trigger": "7月21日录屏未通过机器和人工复核", "mitigation": "预留重录窗口，使用现场、预处理和离线三种兜底"},
    {"risk_id": "TEAM_ELIGIBILITY_UNCONFIRMED", "owner_role": "SUBMISSION_OWNER", "probability": "MEDIUM", "impact": "HIGH", "status": "OPEN", "blocking_scope": "FORMAL_SUBMISSION", "trigger": "7月20日私有名单或报名资料仍不完整", "mitigation": "先完成私有名单QA，再对照报名页人工确认"},
    {"risk_id": "PUBLIC_LINK_UNAVAILABLE", "owner_role": "FINAL_REVIEWER", "probability": "MEDIUM", "impact": "HIGH", "status": "OPEN", "blocking_scope": "FORMAL_SUBMISSION", "trigger": "上传后任一公开入口匿名访问失败", "mitigation": "运行匿名链接检查并人工打开复查"},
    {"risk_id": "SENSITIVE_DATA_LEAK", "owner_role": "FINAL_REVIEWER", "probability": "LOW", "impact": "HIGH", "status": "OPEN", "blocking_scope": "FORMAL_SUBMISSION", "trigger": "预检发现密钥、私有名单、原始素材或绝对路径", "mitigation": "停止提交，清理暂存并重新运行密钥和公开边界检查"},
    {"risk_id": "DGX_CONNECTIVITY", "owner_role": "TECHNICAL_OWNER", "probability": "MEDIUM", "impact": "MEDIUM", "status": "OPEN", "blocking_scope": "DEMO_ONLY", "trigger": "现场SSH隧道或DGX服务不可用", "mitigation": "切换本机现场模式或离线Gold包，不开放公网端口"},
    {"risk_id": "DOCKER_PERMISSION", "owner_role": "TECHNICAL_OWNER", "probability": "HIGH", "impact": "LOW", "status": "ACCEPTED", "blocking_scope": "NON_BLOCKING", "trigger": "决定部署本地GPU模型或VSS", "mitigation": "当前原生Python加FFmpeg路径不处理Docker权限"}
  ],
  "daily_commands": [
    "bash scripts/check_project_board.sh",
    "bash scripts/check_submission.sh",
    "bash scripts/check_pitch.sh",
    "bash scripts/build_release_manifest.sh --verify-only",
    "bash scripts/manage_human_gates.sh status",
    "bash scripts/dgx_demo_tunnel.sh --smoke"
  ],
  "data_policy": {"contains_credentials": false, "contains_personal_data": false, "contains_absolute_paths": false, "goal_blocked": false}
}
